,n_products,n_brands,n_reviews,n_firststar,n_secondstar,n_thirdstar,n_fourstar,n_fivestar,price,avg_reviews,n_brand,avg_review,price_v
Hordeum Vulgare (Barley) Extract,21,"[Origins, Origins, Origins, Origins, DERMAdoctor, Origins, Origins, Origins, Origins, Origins, Origins, Origins, Origins, Origins, Origins, Origins, Origins, boscia, Origins, Origins, Origins]",4029.0,193.0,251.0,302.0,739.0,2546.0,"[41.0, 53.0, 59.0, 43.0, 57.0, 51.0, 59.0, 62.0, 60.0, 43.0, 43.0, 27.5, 44.0, 43.0, 37.0, 60.0, 53.0, 46.0, 59.0, 52.0, 29.0]","[4.5714, 4.0435, 4.6, 4.5773, 4.2283, 4.5625, 3.0, 4.0909, 5.0, 4.3117, 4.3472, 4.2441, 3.9722, 4.3784, 4.1717, 4.5556, 4.1067, 4.5188, 4.5, 4.2403, 4.1376]",3.0,4.29324761905,48.6428571429
Vaccinium Angustifolium (Blueberry) Fruit Extract,2,"[Origins, GLAMGLOW]",82.0,6.0,7.0,9.0,10.0,55.0,"[41.0, 59.0]","[4.5714, 4.12]",2.0,4.3457,50.0
Lycium Chinense (Wolfberry) Fruit Extract,2,"[Origins, GLAMGLOW]",82.0,6.0,7.0,9.0,10.0,55.0,"[41.0, 59.0]","[4.5714, 4.12]",2.0,4.3457,50.0
Rosa Roxburghii Fruit Extract,3,"[Origins, Origins, Origins]",105.0,5.0,11.0,8.0,23.0,58.0,"[41.0, 53.0, 53.0]","[4.5714, 4.0435, 4.1067]",1.0,4.24053333333,49.0
Opuntia Tuna Extract,1,[Origins],7.0,0.0,1.0,0.0,0.0,6.0,[41.0],[4.5714],1.0,4.5714,41.0
Trimethylsiloxysilicate,4,"[Origins, Fresh, AmorePacific, Shiseido]",786.0,40.0,54.0,69.0,153.0,470.0,"[41.0, 38.0, 60.0, 55.0]","[4.5714, 3.4118, 4.2202, 4.3444]",4.0,4.13695,48.5
Hydroxyapatite,1,[Origins],7.0,0.0,1.0,0.0,0.0,6.0,[41.0],[4.5714],1.0,4.5714,41.0
Yeast Extract,17,"[Origins, Omorovicza, Omorovicza, boscia, Lancôme, Omorovicza, boscia, boscia, Algenist, DERMAdoctor, Omorovicza, REN, Omorovicza, Omorovicza, Laura Mercier, IT Cosmetics, boscia]",2758.0,275.0,241.0,304.0,563.0,1376.0,"[41.0, 260.0, 90.0, 38.0, 97.0, 235.0, 36.0, 36.0, 75.0, 57.0, 135.0, 38.0, 160.0, 50.0, 98.0, 48.0, 38.0]","[4.5714, 3.5, 4.381, 3.8571, 4.625, 4.3846, 3.9222, 4.15, 3.9053, 4.2283, 4.7143, 3.8485, 4.0, 5.0, 4.0, 4.6538, 3.8517]",9.0,4.21136470588,90.1176470588
Hydrolyzed Wheat Protein/Pvp Crosspolymer,1,[Origins],7.0,0.0,1.0,0.0,0.0,6.0,[41.0],[4.5714],1.0,4.5714,41.0
Isostearic Acid,19,"[Origins, Eve Lom, Shiseido, bareMinerals, DERMAdoctor, Shiseido, bareMinerals, REN, bareMinerals, AmorePacific, boscia, Shiseido, Shiseido, Shiseido, Omorovicza, bareMinerals, Shiseido, bareMinerals, Shiseido]",5732.0,405.0,413.0,426.0,1065.0,1963.0,"[41.0, 68.0, 175.0, 35.0, 38.0, 57.0, 32.0, 38.0, 29.5, 60.0, 30.0, 45.0, 58.0, 45.0, 135.0, 38.0, 24.0, 35.0, 45.0]","[4.5714, 3.5714, 5.0, 4.4, 3.3798, 3.9091, 3.7895, 3.8485, 3.9032, 4.2202, 4.4746, 4.503, 4.2405, 4.092, 4.1467, 4.6957, 4.3529, 4.4, 3.8551]",9.0,4.17650526316,54.1315789474
Hippophae Rhamnoides Oil,8,"[L’Occitane, Fresh, NUDE Skincare, Fresh, Fresh, Fresh, Fresh, Laura Mercier]",1620.0,88.0,84.0,88.0,233.0,1128.0,"[108.0, 42.0, 0.0, 90.0, 52.0, 90.0, 265.0, 62.0]","[4.1905, 4.5593, 3.8571, 4.0, 4.4389, 4.169, 3.625, 4.451]",4.0,4.16135,88.625
Peg-6,8,"[Shiseido, Origins, Origins, Origins, GLAMGLOW, Origins, Origins, Shiseido]",307.0,16.0,24.0,24.0,67.0,181.0,"[25.0, 53.0, 59.0, 60.0, 59.0, 53.0, 59.0, 58.0]","[4.35, 4.0435, 4.6, 5.0, 4.12, 4.1067, 4.5, 4.2405]",3.0,4.3700875,53.25
Peg-32,5,"[Shiseido, Fresh, Origins, GLAMGLOW, Shiseido]",253.0,17.0,17.0,24.0,49.0,151.0,"[25.0, 67.0, 60.0, 59.0, 58.0]","[4.35, 3.9655, 5.0, 4.12, 4.2405]",4.0,4.3352,53.8
Serine,9,"[Shiseido, Guerlain, AmorePacific, Lancôme, Benefit Cosmetics, Fresh, Murad, SEPHORA COLLECTION, Shiseido]",4458.0,320.0,286.0,306.0,899.0,603.0,"[25.0, 150.0, 100.0, 49.0, 38.0, 40.0, 39.5, 23.0, 40.0]","[4.35, 2.6667, 4.2846, 4.3214, 3.5114, 4.4567, 4.1753, 4.3517, 4.6636]",8.0,4.08682222222,56.0555555556
Menthyl Lactate,3,"[Shiseido, philosophy, boscia]",863.0,38.0,55.0,94.0,238.0,439.0,"[25.0, 65.0, 38.0]","[4.35, 3.8125, 4.14]",3.0,4.10083333333,42.6666666667
Peg-30 Soy Sterol,2,"[Shiseido, Shiseido]",147.0,1.0,7.0,8.0,21.0,110.0,"[25.0, 40.0]","[4.35, 4.6636]",1.0,4.5068,32.5
Aesculus Hippocastanum (Horse Chestnut) Seed Extract,7,"[Shiseido, belif, Eve Lom, Drunk Elephant, Sunday Riley, Murad, Shiseido]",2752.0,189.0,170.0,178.0,514.0,700.0,"[25.0, 58.0, 75.0, 90.0, 65.0, 39.5, 40.0]","[4.35, 5.0, 5.0, 4.2724, 4.2347, 4.1753, 4.6636]",6.0,4.528,56.0714285714
Trisodium Edta,4,"[Shiseido, belif, Shiseido, Shiseido]",120.0,5.0,17.0,8.0,24.0,66.0,"[25.0, 58.0, 90.0, 45.0]","[4.35, 5.0, 4.3333, 3.8551]",2.0,4.3846,54.5
Origanum Majorana Leaf Extract,4,"[Shiseido, Jurlique, Son &amp; Park, Tatcha]",148.0,3.0,9.0,2.0,16.0,121.0,"[25.0, 55.0, 30.0, 110.0]","[4.35, 5.0, 4.8909, 4.5102]",4.0,4.687775,55.0
Yellow 5 (CI 19140),2,"[Shiseido, Peter Thomas Roth]",48.0,3.0,4.0,2.0,12.0,27.0,"[25.0, 28.0]","[4.35, 3.25]",2.0,3.8,26.5
Octyldodecyl Myristate,5,"[Origins, L’Occitane, Laura Mercier, Caudalie, Caudalie]",179.0,15.0,12.0,6.0,36.0,110.0,"[53.0, 28.0, 98.0, 76.0, 158.0]","[4.0435, 4.3913, 4.0, 4.7273, 4.0899]",4.0,4.2504,82.6
Bis-Peg-18 Methyl Ether Dimethyl Silane,5,"[Origins, belif, Lancôme, Origins, GLAMGLOW]",162.0,10.0,11.0,16.0,23.0,107.0,"[53.0, 46.0, 50.0, 60.0, 59.0]","[4.0435, 4.3636, 4.4423, 5.0, 4.12]",4.0,4.39388,53.6
,5,"[Origins, tarte, Caudalie, SK-II, SEPHORA COLLECTION]",2901.0,143.0,199.0,213.0,500.0,62.0,"[53.0, 36.0, 76.0, 385.0, 23.0]","[4.0435, 4.2849, 4.7273, 3.6667, 4.0597]",5.0,4.15642,114.6
Paeonia Albiflora (Peony) Root Extract,2,"[Origins, Origins]",98.0,5.0,10.0,8.0,23.0,52.0,"[53.0, 53.0]","[4.0435, 4.1067]",1.0,4.0751,53.0
Sucrose,8,"[Origins, Peter Thomas Roth, boscia, Dr. Brandt Skincare, Origins, Lancôme, GLAMGLOW, Origins]",596.0,45.0,50.0,39.0,97.0,367.0,"[53.0, 98.0, 34.0, 59.0, 60.0, 49.0, 49.0, 53.0]","[4.0435, 4.0, 4.2056, 4.2432, 5.0, 4.3214, 4.0991, 4.1067]",6.0,4.2524375,56.875
Methyl Gluceth-10/Methyl Gluceth-20,16,"[Origins, philosophy, Kenzoki, Clarisonic, Erborian, Koh Gen Do, GLAMGLOW, boscia, boscia, philosophy, philosophy, First Aid Beauty, philosophy, Givenchy, philosophy, First Aid Beauty]",1670.0,160.0,142.0,159.0,335.0,875.0,"[53.0, 14.0, 22.0, 44.0, 39.0, 85.0, 69.0, 36.0, 28.0, 36.0, 24.0, 36.0, 75.0, 390.0, 40.0, 30.0]","[4.0435, 0.0, 3.6364, 2.3333, 4.3333, 4.375, 3.9591, 3.9222, 3.932, 3.9431, 4.3, 4.3182, 4.037, 4.3125, 3.6575, 3.8197]",10.0,3.682675,63.8125
Laureth-4,2,"[Origins, Peter Thomas Roth]",148.0,10.0,9.0,12.0,27.0,90.0,"[53.0, 62.0]","[4.0435, 4.232]",2.0,4.13775,57.5
Polymethylsilsesquioxane,18,"[Origins, Algenist, SK-II, SK-II, Fresh, boscia, Lancôme, Peter Thomas Roth, Algenist, Dr. Jart+, First Aid Beauty, Benefit Cosmetics, Dr. Jart+, Josie Maran, SK-II, Dr. Jart+, Fresh, SK-II]",1873.0,201.0,168.0,174.0,371.0,967.0,"[53.0, 70.0, 260.0, 225.0, 33.0, 46.0, 65.0, 98.0, 75.0, 35.0, 38.0, 38.0, 52.0, 36.0, 240.0, 36.0, 67.0, 160.0]","[4.0435, 3.2414, 3.0, 4.4464, 3.9381, 3.9933, 4.1733, 4.0, 3.9053, 4.2542, 4.032, 3.5114, 4.1304, 4.0435, 4.5909, 4.25, 4.1092, 4.3111]",11.0,3.99855555556,90.3888888889
Magnesium Ascorbyl Phosphate,12,"[Origins, Murad, REN, Josie Maran, REN, Origins, Origins, Fresh, Dr. Dennis Gross Skincare, GLAMGLOW, Origins, Shiseido]",826.0,71.0,83.0,72.0,166.0,436.0,"[53.0, 55.0, 48.0, 38.0, 38.0, 65.0, 65.0, 38.0, 42.0, 49.0, 44.0, 100.0]","[4.0435, 3.9057, 4.2154, 3.8794, 3.8485, 4.2083, 4.0, 3.4118, 3.5273, 4.0991, 4.0902, 4.6667]",8.0,3.991325,52.9166666667
Cera Alba (Beeswax),6,"[Jurlique, Omorovicza, Laura Mercier, REN, Josie Maran, Fresh]",1276.0,158.0,116.0,120.0,159.0,725.0,"[44.0, 235.0, 98.0, 38.0, 32.0, 92.0]","[4.5393, 4.3846, 4.0, 4.6364, 3.786, 4.0448]",6.0,4.23185,89.8333333333
Sorbitan Oleate &amp; Polyglyceryl-3 Polyricinoleate,1,[Jurlique],89.0,4.0,3.0,4.0,8.0,70.0,[44.0],[4.5393],1.0,4.5393,44.0
Rosa Canina (Rose Hip) Fruit Oil,2,"[Jurlique, Jurlique]",134.0,7.0,4.0,10.0,18.0,95.0,"[44.0, 44.0]","[4.5393, 4.1778]",1.0,4.35855,44.0
Althaea Officinalis (Marshmallow) Root Extract,3,"[Jurlique, Jurlique, Jurlique]",380.0,15.0,11.0,32.0,69.0,253.0,"[44.0, 44.0, 35.0]","[4.5393, 4.1778, 4.3984]",1.0,4.37183333333,41.0
Viola Odorata (Violet) Extract,2,"[Jurlique, Jurlique]",134.0,7.0,4.0,10.0,18.0,95.0,"[44.0, 44.0]","[4.5393, 4.1778]",1.0,4.35855,44.0
Echinacea Purpurea Root Extract,2,"[Jurlique, Jurlique]",134.0,7.0,4.0,10.0,18.0,95.0,"[44.0, 44.0]","[4.5393, 4.1778]",1.0,4.35855,44.0
Viola Tricolor (Heartease) Extract,1,[Jurlique],89.0,4.0,3.0,4.0,8.0,70.0,[44.0],[4.5393],1.0,4.5393,44.0
Magnesium Sulfate,16,"[Jurlique, Dr. Jart+, Supergoop!, Erborian, Dr. Jart+, Lancôme, Lancôme, Fresh, IT Cosmetics, Dr. Jart+, Peter Thomas Roth, IT Cosmetics, Dr. Jart+, Giorgio Armani Beauty, IT Cosmetics, Givenchy]",3488.0,222.0,234.0,258.0,663.0,979.0,"[44.0, 39.0, 30.0, 48.0, 45.0, 97.0, 47.0, 52.0, 38.0, 39.0, 48.0, 38.0, 36.0, 55.0, 38.0, 390.0]","[4.5393, 3.6471, 4.25, 3.0, 4.1127, 4.625, 4.2931, 3.3421, 4.3714, 4.2925, 4.012, 3.84, 4.25, 4.4074, 3.5556, 4.3125]",10.0,4.05316875,67.75
Lauroyl Lysine,7,"[Jurlique, Jurlique, Guerlain, Erborian, L’Occitane, bareMinerals, IT Cosmetics]",2013.0,199.0,192.0,179.0,393.0,1055.0,"[44.0, 44.0, 150.0, 48.0, 42.0, 29.5, 35.0]","[4.5393, 4.1778, 2.6667, 3.0, 4.675, 3.9032, 3.5]",6.0,3.78028571429,56.0714285714
Honey,3,"[Jurlique, Dr. Brandt Skincare, Josie Maran]",199.0,9.0,12.0,14.0,30.0,134.0,"[44.0, 65.0, 42.0]","[4.5393, 4.087, 4.7222]",3.0,4.4495,50.3333333333
Sodium Hydroxymethylglycinate,9,"[Jurlique, REN, REN, REN, REN, REN, REN, REN, Jurlique]",1168.0,73.0,52.0,81.0,239.0,725.0,"[44.0, 48.0, 38.0, 38.0, 50.0, 38.0, 45.0, 30.0, 35.0]","[4.5393, 4.2154, 3.8485, 4.3636, 4.3333, 4.6364, 4.2645, 4.204, 4.3984]",2.0,4.31148888889,40.6666666667
Sodium Ascorbate (Vitamin C),1,[Jurlique],89.0,4.0,3.0,4.0,8.0,70.0,[44.0],[4.5393],1.0,4.5393,44.0
Coumarin,18,"[Jurlique, Lancôme, Lancôme, Jurlique, Erno Laszlo, L’Occitane, Lancôme, L’Occitane, Algenist, Clarins, Lancôme, Jurlique, GLAMGLOW, Caudalie, Fresh, Algenist, KORRES, Caudalie]",3674.0,203.0,185.0,243.0,544.0,2500.0,"[44.0, 97.0, 104.0, 44.0, 55.0, 49.0, 97.0, 28.0, 42.0, 57.0, 97.0, 50.0, 69.0, 76.0, 52.0, 112.0, 45.0, 76.0]","[4.5393, 4.125, 3.5625, 4.1778, 4.8571, 5.0, 4.625, 4.3913, 4.1096, 4.1932, 4.2, 4.58, 4.2721, 4.7273, 4.4389, 4.3818, 4.3685, 4.1136]",10.0,4.37016666667,66.3333333333
Hexylcinnamaldehyde,1,[Jurlique],89.0,4.0,3.0,4.0,8.0,70.0,[44.0],[4.5393],1.0,4.5393,44.0
Limonene From Natural Essential Oil,3,"[Jurlique, Jurlique, Jurlique]",184.0,8.0,5.0,13.0,26.0,132.0,"[44.0, 44.0, 50.0]","[4.5393, 4.1778, 4.58]",1.0,4.43236666667,46.0
Omorovicza’s Patented Hydro Mineral Transference™ Delivery System: Leaves skin looking firmer,1,[Omorovicza],1.0,0.0,0.0,0.0,1.0,0.0,[120.0],[4.0],1.0,4.0,120.0
younger,1,[Omorovicza],1.0,0.0,0.0,0.0,1.0,0.0,[120.0],[4.0],1.0,4.0,120.0
and more supple,1,[Omorovicza],1.0,0.0,0.0,0.0,1.0,0.0,[120.0],[4.0],1.0,4.0,120.0
Gluconolactone,10,"[philosophy, ARDENCY INN, Kate Somerville, Peter Thomas Roth, philosophy, philosophy, REN, Josie Maran, philosophy, Perricone MD]",417.0,35.0,35.0,48.0,107.0,195.0,"[75.0, 29.0, 65.0, 98.0, 36.0, 68.0, 50.0, 36.0, 75.0, 75.0]","[3.0, 4.25, 4.1818, 4.0, 3.9431, 3.3235, 4.3333, 4.0435, 4.037, 4.4722]",7.0,3.95844,60.7
Aluminum Starch Octenylsuccinate,9,"[philosophy, Lancôme, VERSO SKINCARE, First Aid Beauty, Caudalie, Lancôme, Murad, Giorgio Armani Beauty, Lancôme]",2203.0,170.0,136.0,137.0,471.0,284.0,"[75.0, 97.0, 100.0, 38.0, 39.0, 97.0, 39.5, 55.0, 49.0]","[3.0, 4.125, 4.3, 3.7664, 4.0847, 4.2, 4.1753, 4.4074, 4.3519]",7.0,4.04563333333,65.5
Bifida Ferment Lysate,8,"[philosophy, philosophy, philosophy, Koh Gen Do, Koh Gen Do, Koh Gen Do, Lancôme, philosophy]",195.0,31.0,28.0,24.0,30.0,83.0,"[75.0, 35.0, 47.0, 55.0, 85.0, 55.0, 55.0, 75.0]","[3.0, 0.0, 0.0, 3.7727, 4.375, 4.0, 3.2095, 4.037]",3.0,2.799275,60.25
Polysorbate 80,31,"[philosophy, philosophy, Eve Lom, Peter Thomas Roth, Dr. Jart+, Yu-Be, Dr. Jart+, Murad, Peter Thomas Roth, DERMAdoctor, philosophy, First Aid Beauty, Dr. Dennis Gross Skincare, philosophy, Murad, Dr. Jart+, Dr. Jart+, Josie Maran, Peter Thomas Roth, philosophy, GLAMGLOW, Murad, Dr. Dennis Gross Skincare, Dr. Dennis Gross Skincare, Dr. Jart+, philosophy, First Aid Beauty, Peter Thomas Roth, Kate Somerville, Peter Thomas Roth, boscia]",6000.0,405.0,415.0,446.0,1099.0,2502.0,"[75.0, 14.0, 68.0, 28.0, 50.0, 25.0, 60.0, 78.0, 48.0, 38.0, 36.0, 16.0, 30.0, 24.0, 40.0, 42.0, 39.0, 36.0, 48.0, 75.0, 49.0, 72.0, 72.0, 58.0, 34.0, 40.0, 30.0, 72.0, 90.0, 68.0, 36.0]","[3.0, 0.0, 3.5714, 3.25, 4.5, 4.5332, 5.0, 3.8, 4.3235, 3.3798, 3.9431, 4.0, 4.0, 4.3, 3.7568, 3.6512, 4.2925, 4.0435, 4.012, 4.037, 4.0991, 4.4519, 4.1625, 4.037, 4.25, 3.6575, 3.8197, 3.9859, 4.0, 4.3308, 4.0741]",13.0,3.87943548387,48.0967741935
Choleth-24,2,"[philosophy, J.One]",15.0,1.0,2.0,4.0,3.0,6.0,"[75.0, 50.0]","[3.0, 3.9091]",2.0,3.45455,62.5
Ceteth-24,2,"[philosophy, J.One]",15.0,1.0,2.0,4.0,3.0,6.0,"[75.0, 50.0]","[3.0, 3.9091]",2.0,3.45455,62.5
Iris Pallida Root Extract,6,"[philosophy, Origins, Origins, philosophy, Origins, philosophy]",383.0,17.0,34.0,41.0,69.0,222.0,"[75.0, 43.0, 43.0, 75.0, 44.0, 80.0]","[3.0, 4.3704, 4.3117, 4.037, 4.0902, 3.9778]",2.0,3.96451666667,60.0
Ruby Powder,3,"[philosophy, Dr. Brandt Skincare, philosophy]",150.0,9.0,15.0,18.0,27.0,81.0,"[75.0, 65.0, 75.0]","[3.0, 4.087, 4.037]",2.0,3.708,71.6666666667
Mica,51,"[philosophy, Ole Henriksen, MDSolarSciences, belif, belif, Dr. Jart+, First Aid Beauty, Erborian, Algenist, Dr. Brandt Skincare, SK-II, Guerlain, belif, boscia, Peter Thomas Roth, bareMinerals, Peter Thomas Roth, Peter Thomas Roth, COOLA, Peter Thomas Roth, Algenist, Clarins, Shiseido, Dr. Brandt Skincare, REN, St. Tropez Tanning Essentials, Dr. Brandt Skincare, boscia, BURBERRY, belif, Tata Harper, Fresh, Peter Thomas Roth, SEPHORA COLLECTION, Origins, philosophy, SK-II, tarte, Origins, boscia, boscia, IT Cosmetics, Origins, Supergoop!, Tatcha, SEPHORA COLLECTION, Tatcha, Omorovicza, SEPHORA COLLECTION, Shiseido, Shiseido]",9139.0,740.0,708.0,855.0,1809.0,3994.0,"[75.0, 22.0, 68.0, 46.0, 42.0, 39.0, 34.0, 48.0, 70.0, 39.0, 260.0, 29.5, 58.0, 38.0, 62.0, 20.0, 48.0, 98.0, 36.0, 42.0, 65.0, 134.0, 57.0, 65.0, 38.0, 30.0, 155.0, 38.0, 44.0, 38.0, 85.0, 52.0, 48.0, 23.0, 44.0, 75.0, 240.0, 24.0, 37.0, 38.0, 38.0, 35.0, 53.0, 32.0, 135.0, 0.0, 68.0, 135.0, 23.0, 100.0, 45.0]","[3.0, 4.0588, 4.2, 4.3636, 3.2857, 3.6471, 3.7143, 3.0, 3.2414, 3.9, 3.0, 0.0, 5.0, 3.8571, 4.232, 4.0617, 4.3235, 4.0, 4.0294, 4.5192, 4.2235, 4.5, 3.9091, 4.087, 3.8485, 3.4545, 3.5294, 4.2188, 4.2857, 4.2593, 3.3684, 3.3421, 4.012, 4.3517, 3.9722, 4.037, 4.5909, 4.2528, 4.1717, 3.8517, 4.14, 3.5, 4.1067, 4.3711, 3.7391, 3.3978, 3.876, 4.1467, 4.3135, 4.6667, 3.8551]",29.0,3.87868235294,62.1274509804
Peg-8,13,"[philosophy, Erno Laszlo, philosophy, philosophy, Lancôme, philosophy, Lancôme, philosophy, Fresh, GLAMGLOW, philosophy, Origins, Shiseido]",1709.0,104.0,103.0,145.0,294.0,1063.0,"[75.0, 115.0, 50.0, 35.0, 26.0, 47.0, 50.0, 36.0, 67.0, 69.0, 75.0, 52.0, 24.0]","[3.0, 5.0, 0.0, 0.0, 3.75, 0.0, 4.4423, 3.9431, 3.9655, 4.2721, 4.037, 4.2403, 4.3529]",7.0,3.15409230769,55.4615384615
Chitosan,5,"[philosophy, Murad, Murad, philosophy, Murad]",1868.0,142.0,121.0,118.0,394.0,88.0,"[75.0, 55.0, 39.5, 75.0, 48.0]","[3.0, 3.9057, 4.1753, 4.037, 4.325]",2.0,3.8886,58.5
Calcium Gluconate,10,"[philosophy, ARDENCY INN, AmorePacific, Peter Thomas Roth, philosophy, philosophy, REN, Lancôme, Dr. Jart+, philosophy]",609.0,50.0,40.0,58.0,137.0,326.0,"[75.0, 29.0, 100.0, 98.0, 36.0, 68.0, 50.0, 49.0, 52.0, 75.0]","[3.0, 4.25, 4.2846, 4.0, 3.9431, 3.3235, 4.3333, 4.3214, 4.1304, 4.037]",7.0,3.96233,63.2
Behentrimonium Chloride,2,"[philosophy, philosophy]",58.0,5.0,6.0,8.0,6.0,33.0,"[75.0, 75.0]","[3.0, 4.037]",1.0,3.5185,75.0
Coffea Arabica (Coffee) Seed Extract,19,"[philosophy, Erno Laszlo, philosophy, philosophy, philosophy, Origins, Origins, Origins, philosophy, Dr. Dennis Gross Skincare, Origins, philosophy, Origins, GLAMGLOW, philosophy, Origins, Origins, Kopari, philosophy]",585.0,34.0,44.0,53.0,115.0,344.0,"[75.0, 115.0, 14.0, 35.0, 47.0, 59.0, 43.0, 43.0, 36.0, 30.0, 51.0, 24.0, 59.0, 59.0, 75.0, 60.0, 59.0, 44.0, 40.0]","[3.0, 5.0, 0.0, 0.0, 0.0, 4.6, 4.5773, 4.3704, 3.9431, 4.0, 4.5625, 4.3, 3.0, 4.12, 4.037, 4.5556, 4.5, 5.0, 3.6575]",6.0,3.53807368421,50.9473684211
Pongamia Pinnata Seed Extract,8,"[philosophy, philosophy, philosophy, philosophy, philosophy, philosophy, philosophy, philosophy]",264.0,22.0,29.0,31.0,58.0,124.0,"[75.0, 14.0, 35.0, 47.0, 36.0, 24.0, 75.0, 40.0]","[3.0, 0.0, 0.0, 0.0, 3.9431, 4.3, 4.037, 3.6575]",1.0,2.3672,43.25
Isopropyl Alcohol,3,"[philosophy, philosophy, Shiseido]",148.0,10.0,9.0,15.0,22.0,92.0,"[75.0, 75.0, 55.0]","[3.0, 4.037, 4.3444]",2.0,3.7938,68.3333333333
Acetic Acid,4,"[philosophy, philosophy, philosophy, philosophy]",58.0,5.0,6.0,8.0,6.0,33.0,"[75.0, 35.0, 47.0, 75.0]","[3.0, 0.0, 0.0, 4.037]",1.0,1.75925,58.0
Angelica Archangelica Root Extract,8,"[philosophy, philosophy, philosophy, philosophy, philosophy, philosophy, philosophy, philosophy]",264.0,22.0,29.0,31.0,58.0,124.0,"[75.0, 14.0, 35.0, 47.0, 36.0, 24.0, 75.0, 40.0]","[3.0, 0.0, 0.0, 0.0, 3.9431, 4.3, 4.037, 3.6575]",1.0,2.3672,43.25
Bha,2,"[philosophy, philosophy]",58.0,5.0,6.0,8.0,6.0,33.0,"[75.0, 75.0]","[3.0, 4.037]",1.0,3.5185,75.0
Beeswax,9,"[Lancôme, Laura Mercier, Dr. Jart+, Dr. Jart+, Koh Gen Do, Dr. Jart+, Dr. Dennis Gross Skincare, Lancôme, Jao]",132.0,11.0,13.0,12.0,28.0,68.0,"[97.0, 98.0, 48.0, 39.0, 55.0, 60.0, 75.0, 97.0, 48.0]","[4.125, 3.7143, 3.6047, 3.6471, 4.0, 5.0, 3.9, 4.2, 4.5556]",6.0,4.08296666667,68.5555555556
Sucrose Stearate,9,"[Lancôme, Human + Kind, Dr. Brandt Skincare, AmorePacific, Shiseido, Origins, Lancôme, Lancôme, Origins]",714.0,33.0,32.0,55.0,157.0,437.0,"[97.0, 0.0, 39.0, 100.0, 33.5, 65.0, 97.0, 49.0, 52.0]","[4.125, 3.8333, 3.9, 4.2846, 4.4779, 4.0, 4.2, 4.3519, 4.2403]",6.0,4.157,59.1666666667
Saccharomyces/Xylinum/ Black Tea Ferment,3,"[Lancôme, Lancôme, Lancôme]",38.0,2.0,3.0,2.0,9.0,22.0,"[97.0, 97.0, 119.0]","[4.125, 4.2, 4.2941]",1.0,4.20636666667,104.333333333
Hydrolyzed Hyaluronic Acid,17,"[Lancôme, Dr. Jart+, philosophy, Dr. Jart+, Lancer, philosophy, philosophy, Lancôme, IT Cosmetics, Sunday Riley, Caudalie, IT Cosmetics, Lancôme, IT Cosmetics, Kate Somerville, philosophy, Kate Somerville]",827.0,67.0,61.0,76.0,152.0,477.0,"[97.0, 48.0, 14.0, 50.0, 185.0, 36.0, 24.0, 97.0, 38.0, 65.0, 76.0, 38.0, 119.0, 38.0, 89.0, 40.0, 90.0]","[4.125, 3.6047, 0.0, 4.5, 5.0, 3.9431, 4.3, 4.2, 4.3714, 4.2347, 4.7273, 3.84, 4.2941, 3.5556, 0.0, 3.6575, 4.0]",8.0,3.66784705882,67.2941176471
Red 4,2,"[Lancôme, Lancôme]",21.0,2.0,1.0,1.0,5.0,12.0,"[97.0, 97.0]","[4.125, 4.2]",1.0,4.1625,97.0
Acetyl Tetrapeptide-9,5,"[Lancôme, Lancôme, Lancôme, Algenist, Yves Saint Laurent]",440.0,32.0,21.0,25.0,68.0,294.0,"[97.0, 97.0, 119.0, 96.0, 52.0]","[4.125, 4.2, 4.2941, 4.3546, 4.2252]",3.0,4.23978,92.2
Yellow 5,3,"[Lancôme, Lancôme, Lancôme]",94.0,3.0,5.0,6.0,19.0,61.0,"[97.0, 97.0, 52.0]","[4.125, 4.2, 4.4521]",1.0,4.25903333333,82.0
Dimethiconol,24,"[Lancôme, Lancôme, philosophy, philosophy, First Aid Beauty, Dr. Jart+, SK-II, Erborian, Dr. Brandt Skincare, Dr. Brandt Skincare, Dr. Brandt Skincare, Clarins, J.One, Lancôme, Fresh, AmorePacific, Lancôme, Giorgio Armani Beauty, Dr. Dennis Gross Skincare, boscia, AmorePacific, Lancôme, Erno Laszlo, boscia]",2296.0,121.0,169.0,199.0,513.0,1296.0,"[97.0, 104.0, 30.0, 50.0, 34.0, 60.0, 160.0, 43.0, 65.0, 61.0, 59.0, 53.0, 50.0, 97.0, 40.0, 195.0, 119.0, 55.0, 72.0, 38.0, 150.0, 49.0, 90.0, 36.0]","[4.125, 3.5625, 4.2, 0.0, 3.7143, 5.0, 4.2, 4.1081, 4.087, 3.9717, 4.2432, 3.5, 3.9091, 4.2, 4.4567, 4.3368, 4.2941, 4.4074, 4.1625, 4.14, 4.1667, 4.3519, 4.6842, 4.0741]",15.0,3.9956375,75.2916666667
Disodium Stearoyl Glutamate,6,"[Lancôme, Lancôme, Lancôme, Lancôme, Giorgio Armani Beauty, Too Cool For School]",312.0,18.0,28.0,31.0,50.0,189.0,"[97.0, 47.0, 88.0, 97.0, 55.0, 36.0]","[4.125, 4.2931, 4.3061, 4.2, 4.4074, 3.9615]",3.0,4.21551666667,70.0
USDA National Organic Program Certified Organic Extracts,2,"[KAPLAN MD, KAPLAN MD]",7.0,0.0,2.0,1.0,1.0,3.0,"[115.0, 100.0]","[3.0, 4.0]",1.0,3.5,107.5
Adipic Acid/Neopentyl Glycol Crosspolymer,2,"[Ole Henriksen, Sunday Riley]",311.0,16.0,19.0,33.0,54.0,190.0,"[22.0, 65.0]","[4.0588, 4.2347]",2.0,4.14675,43.5
Biosaccharide gum-1,1,[Ole Henriksen],17.0,2.0,1.0,0.0,5.0,9.0,[22.0],[4.0588],1.0,4.0588,22.0
Glyceryl Polymethacrylate,9,"[Ole Henriksen, Origins, Origins, Erborian, IT Cosmetics, Murad, Origins, Too Cool For School, Origins]",1210.0,59.0,75.0,112.0,231.0,738.0,"[22.0, 43.0, 62.0, 43.0, 48.0, 72.0, 37.0, 36.0, 52.0]","[4.0588, 4.3704, 4.0909, 4.3333, 4.6538, 4.4519, 4.1717, 3.9615, 4.2403]",6.0,4.25917777778,46.1111111111
Glucosamine HCL,10,"[Ole Henriksen, Murad, bareMinerals, Algenist, DERMAdoctor, bareMinerals, Algenist, bareMinerals, Algenist, bareMinerals]",576.0,37.0,32.0,33.0,87.0,387.0,"[22.0, 78.0, 35.0, 78.0, 57.0, 32.0, 94.0, 38.0, 94.0, 35.0]","[4.0588, 3.8, 4.4, 4.3333, 4.2283, 3.7895, 4.3385, 4.6957, 4.3613, 4.4]",5.0,4.24054,56.3
Menthyl Ethylamido Oxalate,1,[Ole Henriksen],17.0,2.0,1.0,0.0,5.0,9.0,[22.0],[4.0588],1.0,4.0588,22.0
Pisum Sativum (Pea) Extract,32,"[Ole Henriksen, Dr. Dennis Gross Skincare, Tria, philosophy, philosophy, Dr. Brandt Skincare, Tria, Origins, Primary Raw, belif, Erborian, Lancer, Caudalie, Algenist, Blithe, Dr. Brandt Skincare, Origins, Laura Mercier, Jurlique, Farmacy, Origins, Clarins, Sunday Riley, Sunday Riley, Herbivore, Origins, Algenist, Origins, Algenist, Algenist, Dr. Brandt Skincare, Kate Somerville]",1953.0,186.0,131.0,144.0,290.0,1207.0,"[22.0, 42.0, 65.0, 35.0, 47.0, 39.0, 60.0, 59.0, 46.0, 58.0, 36.0, 185.0, 39.0, 78.0, 46.0, 155.0, 59.0, 98.0, 55.0, 40.0, 60.0, 92.0, 65.0, 80.0, 58.0, 60.0, 96.0, 59.0, 94.0, 94.0, 135.0, 90.0]","[4.0588, 2.614, 5.0, 0.0, 0.0, 3.9, 0.0, 4.6, 3.8462, 5.0, 4.525, 5.0, 4.1215, 4.3333, 5.0, 3.5294, 3.0, 4.0, 5.0, 3.3873, 5.0, 4.1765, 4.2347, 4.2609, 3.8071, 4.5556, 4.3546, 4.5, 4.3385, 4.3613, 4.0909, 4.0]",20.0,3.8311125,70.21875
Bambusa vulgaris stem/leaf extract,1,[Ole Henriksen],17.0,2.0,1.0,0.0,5.0,9.0,[22.0],[4.0588],1.0,4.0588,22.0
Polyisobutene,9,"[Ole Henriksen, Tria, Blithe, Dr. Jart+, AmorePacific, Ole Henriksen, AmorePacific, Kate Somerville, AmorePacific]",903.0,50.0,55.0,72.0,153.0,574.0,"[22.0, 60.0, 49.0, 48.0, 195.0, 55.0, 150.0, 85.0, 195.0]","[4.0588, 0.0, 4.6316, 4.5106, 4.3368, 4.2459, 4.1667, 4.3115, 3.8125]",6.0,3.78604444444,95.4444444444
VP/VA Copolymer,1,[Ole Henriksen],17.0,2.0,1.0,0.0,5.0,9.0,[22.0],[4.0588],1.0,4.0588,22.0
Chondrus Crispus(Carrageenan),1,[Ole Henriksen],17.0,2.0,1.0,0.0,5.0,9.0,[22.0],[4.0588],1.0,4.0588,22.0
Hydrolyzed hyaluronic acid,1,[Ole Henriksen],17.0,2.0,1.0,0.0,5.0,9.0,[22.0],[4.0588],1.0,4.0588,22.0
Glycine,5,"[Ole Henriksen, Lancôme, Murad, AmorePacific, Murad]",2041.0,148.0,120.0,126.0,448.0,194.0,"[22.0, 49.0, 70.0, 100.0, 39.5]","[4.0588, 4.2308, 4.3571, 4.2846, 4.1753]",4.0,4.22132,56.1
Amodimethicone,1,[Ole Henriksen],17.0,2.0,1.0,0.0,5.0,9.0,[22.0],[4.0588],1.0,4.0588,22.0
PEG-7 Trimethylolpropane Coconut Ether,1,[Ole Henriksen],17.0,2.0,1.0,0.0,5.0,9.0,[22.0],[4.0588],1.0,4.0588,22.0
Sea Salt,2,"[Ole Henriksen, Josie Maran]",158.0,15.0,16.0,17.0,32.0,78.0,"[22.0, 38.0]","[4.0588, 3.8794]",2.0,3.9691,30.0
Copper Tripeptide-1,6,"[Ole Henriksen, Dr. Jart+, Murad, Dr. Jart+, Primary Raw, Primary Raw]",57.0,3.0,1.0,3.0,11.0,39.0,"[22.0, 50.0, 70.0, 60.0, 38.0, 46.0]","[4.0588, 4.5, 4.3571, 5.0, 4.4444, 4.9]",4.0,4.54338333333,47.6666666667
Dihydroxyacetone,3,"[Dr. Dennis Gross Skincare, St. Tropez Tanning Essentials, St. Tropez Tanning Essentials]",204.0,46.0,25.0,22.0,32.0,79.0,"[42.0, 30.0, 35.0]","[2.614, 3.4545, 3.8571]",2.0,3.30853333333,35.6666666667
Ergocalciferol,1,[Dr. Dennis Gross Skincare],57.0,21.0,10.0,6.0,10.0,10.0,[42.0],[2.614],1.0,2.614,42.0
Disodium Lauriminodipropionate Tocopheryl Phosphates,3,"[Dr. Dennis Gross Skincare, Dr. Dennis Gross Skincare, Dr. Dennis Gross Skincare]",193.0,30.0,16.0,17.0,32.0,98.0,"[42.0, 125.0, 78.0]","[2.614, 4.0357, 4.3426]",1.0,3.6641,81.6666666667
Ceramide 2,10,"[Dr. Dennis Gross Skincare, Tria, Koh Gen Do, Kate Somerville, Dr. Dennis Gross Skincare, Ole Henriksen, Dr. Dennis Gross Skincare, Caudalie, Dr. Jart+, Perricone MD]",891.0,89.0,62.0,70.0,163.0,508.0,"[42.0, 65.0, 85.0, 150.0, 125.0, 48.0, 78.0, 158.0, 49.0, 80.0]","[2.614, 5.0, 4.375, 4.125, 4.0357, 4.0056, 4.3426, 4.0899, 4.4906, 4.3077]",8.0,4.13861,88.0
Cyclodextrin,9,"[Dr. Dennis Gross Skincare, KORRES, Dr. Dennis Gross Skincare, Dr. Dennis Gross Skincare, Caudalie, Dr. Dennis Gross Skincare, Drunk Elephant, Dr. Dennis Gross Skincare, Dr. Dennis Gross Skincare]",978.0,74.0,73.0,79.0,158.0,594.0,"[42.0, 34.0, 62.0, 65.0, 39.0, 125.0, 52.0, 72.0, 78.0]","[2.614, 4.2914, 4.125, 4.75, 4.1215, 4.0357, 4.2412, 4.1625, 4.3426]",4.0,4.07598888889,63.2222222222
Pentasodium Pentetate,4,"[Dr. Dennis Gross Skincare, Koh Gen Do, Dr. Dennis Gross Skincare, Dr. Dennis Gross Skincare]",215.0,34.0,17.0,20.0,34.0,110.0,"[42.0, 55.0, 125.0, 78.0]","[2.614, 3.7727, 4.0357, 4.3426]",2.0,3.69125,75.0
Phytic Acid,10,"[Dr. Dennis Gross Skincare, Eve Lom, Koh Gen Do, Kate Somerville, Dr. Dennis Gross Skincare, Dr. Dennis Gross Skincare, Dr. Dennis Gross Skincare, Perricone MD, stila, Dr. Dennis Gross Skincare]",821.0,94.0,65.0,69.0,142.0,451.0,"[42.0, 68.0, 85.0, 65.0, 62.0, 125.0, 30.0, 135.0, 38.0, 78.0]","[2.614, 3.5714, 4.375, 4.1818, 4.125, 4.0357, 4.0, 3.7952, 4.1306, 4.3426]",6.0,3.91713,72.8
Potassium Citrate,3,"[Dr. Dennis Gross Skincare, Dr. Dennis Gross Skincare, Dr. Dennis Gross Skincare]",193.0,30.0,16.0,17.0,32.0,98.0,"[42.0, 125.0, 78.0]","[2.614, 4.0357, 4.3426]",1.0,3.6641,81.6666666667
